{"artifacts":[],"assurance_eligibility":"not_eligible","capability":{"checks":["bugprone-argument-comment","bugprone-assert-side-effect","bugprone-assignment-in-if-condition","bugprone-bad-signal-to-kill-thread","bugprone-bool-pointer-implicit-conversion","bugprone-branch-clone","bugprone-casting-through-void","bugprone-chained-comparison","bugprone-compare-pointer-to-member-virtual-function","bugprone-copy-constructor-init","bugprone-crtp-constructor-accessibility","bugprone-dangling-handle","bugprone-dynamic-static-initializers","bugprone-easily-swappable-parameters","bugprone-empty-catch","bugprone-exception-escape","bugprone-fold-init-type","bugprone-forward-declaration-namespace","bugprone-forwarding-reference-overload","bugprone-implicit-widening-of-multiplication-result","bugprone-inaccurate-erase","bugprone-inc-dec-in-conditions","bugprone-incorrect-enable-if","bugprone-incorrect-roundings","bugprone-infinite-loop","bugprone-integer-division","bugprone-lambda-function-name","bugprone-macro-parentheses","bugprone-macro-repeated-side-effects","bugprone-misplaced-operator-in-strlen-in-alloc","bugprone-misplaced-pointer-arithmetic-in-alloc","bugprone-misplaced-widening-cast","bugprone-move-forwarding-reference","bugprone-multi-level-implicit-pointer-conversion","bugprone-multiple-new-in-one-expression","bugprone-multiple-statement-macro","bugprone-narrowing-conversions","bugprone-no-escape","bugprone-non-zero-enum-to-bool-conversion","bugprone-not-null-terminated-result","bugprone-optional-value-conversion","bugprone-parent-virtual-call","bugprone-pointer-arithmetic-on-polymorphic-object","bugprone-posix-return","bugprone-redundant-branch-condition","bugprone-reserved-identifier","bugprone-return-const-ref-from-parameter","bugprone-shared-ptr-array-mismatch","bugprone-signal-handler","bugprone-signed-char-misuse","bugprone-sizeof-container","bugprone-sizeof-expression","bugprone-spuriously-wake-up-functions","bugprone-standalone-empty","bugprone-string-constructor","bugprone-string-integer-assignment","bugprone-string-literal-with-embedded-nul","bugprone-stringview-nullptr","bugprone-suspicious-enum-usage","bugprone-suspicious-include","bugprone-suspicious-memory-comparison","bugprone-suspicious-memset-usage","bugprone-suspicious-missing-comma","bugprone-suspicious-realloc-usage","bugprone-suspicious-semicolon","bugprone-suspicious-string-compare","bugprone-suspicious-stringview-data-usage","bugprone-swapped-arguments","bugprone-switch-missing-default-case","bugprone-terminating-continue","bugprone-throw-keyword-missing","bugprone-too-small-loop-variable","bugprone-unchecked-optional-access","bugprone-undefined-memory-manipulation","bugprone-undelegated-constructor","bugprone-unhandled-exception-at-new","bugprone-unhandled-self-assignment","bugprone-unique-ptr-array-mismatch","bugprone-unsafe-functions","bugprone-unused-local-non-trivial-variable","bugprone-unused-raii","bugprone-unused-return-value","bugprone-use-after-move","bugprone-virtual-near-miss","cert-con36-c","cert-con54-cpp","cert-ctr56-cpp","cert-dcl03-c","cert-dcl16-c","cert-dcl37-c","cert-dcl50-cpp","cert-dcl51-cpp","cert-dcl54-cpp","cert-dcl58-cpp","cert-dcl59-cpp","cert-env33-c","cert-err09-cpp","cert-err33-c","cert-err34-c","cert-err52-cpp","cert-err58-cpp","cert-err60-cpp","cert-err61-cpp","cert-exp42-c","cert-fio38-c","cert-flp30-c","cert-flp37-c","cert-int09-c","cert-mem57-cpp","cert-msc24-c","cert-msc30-c","cert-msc32-c","cert-msc33-c","cert-msc50-cpp","cert-msc51-cpp","cert-msc54-cpp","cert-oop11-cpp","cert-oop54-cpp","cert-oop57-cpp","cert-oop58-cpp","cert-pos44-c","cert-pos47-c","cert-sig30-c","cert-str34-c","clang-analyzer-apiModeling.Errno","clang-analyzer-apiModeling.TrustNonnull","clang-analyzer-apiModeling.TrustReturnsNonnull","clang-analyzer-apiModeling.google.GTest","clang-analyzer-apiModeling.llvm.CastValue","clang-analyzer-apiModeling.llvm.ReturnValue","clang-analyzer-core.BitwiseShift","clang-analyzer-core.CallAndMessage","clang-analyzer-core.CallAndMessageModeling","clang-analyzer-core.DivideZero","clang-analyzer-core.DynamicTypePropagation","clang-analyzer-core.NonNullParamChecker","clang-analyzer-core.NonnilStringConstants","clang-analyzer-core.NullDereference","clang-analyzer-core.StackAddrEscapeBase","clang-analyzer-core.StackAddressEscape","clang-analyzer-core.UndefinedBinaryOperatorResult","clang-analyzer-core.VLASize","clang-analyzer-core.builtin.BuiltinFunctions","clang-analyzer-core.builtin.NoReturnFunctions","clang-analyzer-core.uninitialized.ArraySubscript","clang-analyzer-core.uninitialized.Assign","clang-analyzer-core.uninitialized.Branch","clang-analyzer-core.uninitialized.CapturedBlockVariable","clang-analyzer-core.uninitialized.NewArraySize","clang-analyzer-core.uninitialized.UndefReturn","clang-analyzer-cplusplus.ArrayDelete","clang-analyzer-cplusplus.InnerPointer","clang-analyzer-cplusplus.Move","clang-analyzer-cplusplus.NewDelete","clang-analyzer-cplusplus.NewDeleteLeaks","clang-analyzer-cplusplus.PlacementNew","clang-analyzer-cplusplus.PureVirtualCall","clang-analyzer-cplusplus.SelfAssignment","clang-analyzer-cplusplus.SmartPtrModeling","clang-analyzer-cplusplus.StringChecker","clang-analyzer-cplusplus.VirtualCallModeling","clang-analyzer-deadcode.DeadStores","clang-analyzer-fuchsia.HandleChecker","clang-analyzer-nullability.NullPassedToNonnull","clang-analyzer-nullability.NullReturnedFromNonnull","clang-analyzer-nullability.NullabilityBase","clang-analyzer-nullability.NullableDereferenced","clang-analyzer-nullability.NullablePassedToNonnull","clang-analyzer-nullability.NullableReturnedFromNonnull","clang-analyzer-optin.core.EnumCastOutOfRange","clang-analyzer-optin.cplusplus.UninitializedObject","clang-analyzer-optin.cplusplus.VirtualCall","clang-analyzer-optin.mpi.MPI-Checker","clang-analyzer-optin.osx.OSObjectCStyleCast","clang-analyzer-optin.osx.cocoa.localizability.EmptyLocalizationContextChecker","clang-analyzer-optin.osx.cocoa.localizability.NonLocalizedStringChecker","clang-analyzer-optin.performance.GCDAntipattern","clang-analyzer-optin.performance.Padding","clang-analyzer-optin.portability.UnixAPI","clang-analyzer-optin.taint.TaintedAlloc","clang-analyzer-osx.API","clang-analyzer-osx.MIG","clang-analyzer-osx.NSOrCFErrorDerefChecker","clang-analyzer-osx.NumberObjectConversion","clang-analyzer-osx.OSObjectRetainCount","clang-analyzer-osx.ObjCProperty","clang-analyzer-osx.SecKeychainAPI","clang-analyzer-osx.cocoa.AtSync","clang-analyzer-osx.cocoa.AutoreleaseWrite","clang-analyzer-osx.cocoa.ClassRelease","clang-analyzer-osx.cocoa.Dealloc","clang-analyzer-osx.cocoa.IncompatibleMethodTypes","clang-analyzer-osx.cocoa.Loops","clang-analyzer-osx.cocoa.MissingSuperCall","clang-analyzer-osx.cocoa.NSAutoreleasePool","clang-analyzer-osx.cocoa.NSError","clang-analyzer-osx.cocoa.NilArg","clang-analyzer-osx.cocoa.NonNilReturnValue","clang-analyzer-osx.cocoa.ObjCGenerics","clang-analyzer-osx.cocoa.RetainCount","clang-analyzer-osx.cocoa.RetainCountBase","clang-analyzer-osx.cocoa.RunLoopAutoreleaseLeak","clang-analyzer-osx.cocoa.SelfInit","clang-analyzer-osx.cocoa.SuperDealloc","clang-analyzer-osx.cocoa.UnusedIvars","clang-analyzer-osx.cocoa.VariadicMethodTypes","clang-analyzer-osx.coreFoundation.CFError","clang-analyzer-osx.coreFoundation.CFNumber","clang-analyzer-osx.coreFoundation.CFRetainRelease","clang-analyzer-osx.coreFoundation.containers.OutOfBounds","clang-analyzer-osx.coreFoundation.containers.PointerSizedValues","clang-analyzer-security.FloatLoopCounter","clang-analyzer-security.PutenvStackArray","clang-analyzer-security.SetgidSetuidOrder","clang-analyzer-security.cert.env.InvalidPtr","clang-analyzer-security.insecureAPI.DeprecatedOrUnsafeBufferHandling","clang-analyzer-security.insecureAPI.SecuritySyntaxChecker","clang-analyzer-security.insecureAPI.UncheckedReturn","clang-analyzer-security.insecureAPI.bcmp","clang-analyzer-security.insecureAPI.bcopy","clang-analyzer-security.insecureAPI.bzero","clang-analyzer-security.insecureAPI.decodeValueOfObjCType","clang-analyzer-security.insecureAPI.getpw","clang-analyzer-security.insecureAPI.gets","clang-analyzer-security.insecureAPI.mkstemp","clang-analyzer-security.insecureAPI.mktemp","clang-analyzer-security.insecureAPI.rand","clang-analyzer-security.insecureAPI.strcpy","clang-analyzer-security.insecureAPI.vfork","clang-analyzer-unix.API","clang-analyzer-unix.BlockInCriticalSection","clang-analyzer-unix.DynamicMemoryModeling","clang-analyzer-unix.Errno","clang-analyzer-unix.Malloc","clang-analyzer-unix.MallocSizeof","clang-analyzer-unix.MismatchedDeallocator","clang-analyzer-unix.StdCLibraryFunctions","clang-analyzer-unix.Stream","clang-analyzer-unix.Vfork","clang-analyzer-unix.cstring.BadSizeArg","clang-analyzer-unix.cstring.CStringModeling","clang-analyzer-unix.cstring.NullArg","clang-analyzer-valist.CopyToSelf","clang-analyzer-valist.Uninitialized","clang-analyzer-valist.Unterminated","clang-analyzer-valist.ValistBase","clang-analyzer-webkit.NoUncountedMemberChecker","clang-analyzer-webkit.RefCntblBaseVirtualDtor","clang-analyzer-webkit.UncountedLambdaCapturesChecker","cppcoreguidelines-avoid-c-arrays","cppcoreguidelines-avoid-capturing-lambda-coroutines","cppcoreguidelines-avoid-const-or-ref-data-members","cppcoreguidelines-avoid-do-while","cppcoreguidelines-avoid-goto","cppcoreguidelines-avoid-magic-numbers","cppcoreguidelines-avoid-non-const-global-variables","cppcoreguidelines-avoid-reference-coroutine-parameters","cppcoreguidelines-c-copy-assignment-signature","cppcoreguidelines-explicit-virtual-functions","cppcoreguidelines-init-variables","cppcoreguidelines-interfaces-global-init","cppcoreguidelines-macro-to-enum","cppcoreguidelines-macro-usage","cppcoreguidelines-misleading-capture-default-by-value","cppcoreguidelines-missing-std-forward","cppcoreguidelines-narrowing-conversions","cppcoreguidelines-no-malloc","cppcoreguidelines-no-suspend-with-lock","cppcoreguidelines-noexcept-destructor","cppcoreguidelines-noexcept-move-operations","cppcoregui